file_path,article_id,title,summary,date,month,year,published_at,country,company,case_type,related_to,monetary_amounts
C:\Users\z004xh1j\OneDrive - Innomotics\Desktop\Comapass_Lexecon_Case_Study\data\raw_data\EC press releases part 3\ip_16_5728.html,ip_16_5728,investment plan for europe eif and equa bank sign an agreement to benefit czech smes,the european investment fund eif and equa bank have signed a cosme agreement in the czech republic benefiting from the support of the european fund for strategic investments efsi a key pillar of the investment plan for europe which aims to revive investment in strategic projects around europe the cosme agreement will allow equa bank to provide czk 1 8bn ca eur 66 5m of loans to smes over the next two years the loans will be provided with substantially reduced collateral requirements as a result of a guarantee from eif under the cosme programme with financial backing from the european commission it is expected that the agreement will make it possible for equa bank to support additional financing at favourable conditions to over 250 smes elżbieta bieńkowska eu commissioner for internal market industry entrepreneurship and smes said this efsi backed cosme deal demonstrates once again that the eu actively supports small businesses the biggest job creators in the czech republic and across the eu thanks to this agreement more than 250 small companies in the czech republic will gain access to the finance they need to grow their businesses which is great news commenting on the signature eif deputy chief executive roger havenith said this new efsi guarantee agreement with equa bank will help czech companies to benefit from loans with substantially reduced collateral requirements enhancing access to finance lies at the heart of both eif and efsi s strategy and this guarantee is an example of how we are able to achieve this aim petr řehák chief executive at equa bank said part of equa bank s core mission is to support the development of entrepreneurs and small businesses which are one of the key drivers of economic growth we are therefore delighted that equa bank is one of only three banks on the czech market which signed the agreement with eif thanks to the cosme programme we will expand financing possibilities to a larger community of sme clients this transaction reflects the eib group s commitment to respond swiftly to calls from member states the european commission and the european parliament for a rapid launch of concrete initiatives under efsi accelerating lending and guarantee transactions capable of boosting jobs and growth in the eu about cosme cosme is the eu programme for the competitiveness of enterprises and small and medium sized enterprises smes running from 2014 to 2020 with a total budget of eur 2 3 billion at least 60 of the programme will be devoted to ease access to finance for smes in europe with two financial instruments the cosme loan guarantee facility supports guarantees and counter guarantees to financial institutions to help them provide more loans and lease finance to smes this facility also includes securitisation of sme debt finance portfolios the cosme programme also invests through the cosme equity facility for growth in equity funds that provide risk capital to smes mainly in the expansion and growth stages the cosme programme builds on the success of the competitiveness and innovation framework programme cip 2007 2013 which helped to mobilise almost eur 21 billion of loans and more than eur 3 billion of venture capital to over 381 000 smes in europe businesses can contact selected financial institutions in their country to access eu financing http www access2finance eu about the investment plan for europe the investment plan focuses on removing obstacles to investment providing visibility and technical assistance to investment projects and making smarter use of new and existing financial resources the investment plan is already showing results the european investment bank eib estimates that by may 2016 the european fund for strategic investments efsi was expected to have triggered more than 100 billion of investment in europe find out the latest efsi figures including a break down by sector and by country here for more information see the faqs about the eif the european investment fund eif is part of the european investment bank group its central mission is to support europe s micro small and medium sized businesses by helping them to access finance eif designs and develops both venture and growth capital guarantees and microfinance instruments which specifically target this market segment about equa bank equa bank a s entered the czech market in 2011 and currently has more than 200 000 customers and operates 59 branches all over the czech republic equa bank offers simple understandable and transparent retail and corporate banking services including free of charge current and savings accounts multi monetary contactless payment cards golden payment cards mortgages consumer loans insurance time deposits and business loans equa banks sole shareholder is anacap financial partner funds owned company equa group ltd anacap is one of the leading european private equity firms focusing solely on the european financial services sector equa bank won many prestigious awards since its market entry for example equa bank won only in 2015 six awards in the golden crown competition and its current account defended the first place in the prize of the public for the second time golden crown won in the loans and mortgages category as well in the competition hospodářské noviny s best bank in 2015 was equa bank ranked second in the category of most client friendly bank equa bank received also foreign awards equa bank was recognized two times in a row the best retail bank in the czech republic according to the prestigious global banking finance review magazine,27/05/2016,may,2016,,,equa bank,investment plan,,2300000000.00; 21000000000.00; 3000000000.00; 100000000000.00
C:\Users\z004xh1j\OneDrive - Innomotics\Desktop\Comapass_Lexecon_Case_Study\data\raw_data\EC press releases part 3\ip_16_5870.html,ip_16_5870,investment plan for europe eif and banca sella sign eur 80 million agreement to benefit innovative italian smes,the european investment fund eif and banca sella s p a banca sella have signed an innovfin agreement for smes and small mid caps in italy benefitting from the support of the european fund for strategic investments efsi the heart of the investment plan for europe the innovfin agreement will enable banca sella to provide finance to innovative companies in italy over the next 2 years with the support of a guarantee provided by eif and backed under horizon 2020 the eu framework programme for research and innovation the eu support for innovative italian companies is expected to generate a portfolio of eur 80 million of loans speaking at the signature ceremony in biella eif s chief executive pier luigi gilibert said this new transaction with banca sella demonstrates that there is a good appetite in italy for finance for smes banca sella plays an important role in financing innovative companies especially in the region this signature in biella today brings our total support for italian businesses under efsi to eur 7 6 billion which is a substantial amount of additional finance eu commissioner for research science and innovation carlos moedas stated with this new transaction worth eur 80 million benefitting italian smes under the efsi i am pleased to see the success that the investment plan for europe has encountered in italy so far as one of the largest family owned banks in italy banca sella will considerably help particularly innovative companies in putting their business plans into practice commenting on the operation banca sella s chairman maurizio sella said the agreement with the european investment fund eif has particular relevance in that it aims at strengthening financial support to smes and small midcaps traditionally supported by our bank today these companies are strongly committed to improve and to adapt their processes to the new technologies moreover the ability to innovate is one of the key elements for the growth and development of the economy and in particular of any company stepping into the market to offer its products and services to customers in competition with other companies and above all in the present context marked by an ever increasing globalization of the markets and by the strong boost of high technological content innovation that digital economy brought forth we therefore have the task to support them in this process offering the best loan instruments available the deal signed today in italy reflects the eu s commitment to rapidly launch concrete initiatives under the efsi accelerating lending and guaranteeing transactions capable of boosting jobs and growth in the eu about eif the european investment fund eif is part of the european investment bank group its central mission is to support europe s micro small and medium sized businesses smes by helping them to access finance eif designs and develops venture and growth capital guarantees and microfinance instruments which specifically target this market segment in this role eif fosters eu objectives in support of innovation research and development entrepreneurship growth and employment more information on the eif s work under the efsi is available here about the investment plan for europe the investment plan for europe focuses on removing obstacles to investment providing visibility and technical assistance to investment projects and making smarter use of new and existing financial resources the eib estimates that by june 2016 the european fund for strategic investments efsi is expected to have triggered more than eur 106 8 billion of investment in europe find out the latest efsi figures including a break down by sector and by country here for more information see the faqs about innovfin the innovfin sme guarantee facility provides guarantees and counter guarantees on debt financing of between eur 25 000 and eur 7 5 million in order to improve access to loan finance for innovative small and medium sized enterprises and small mid caps up to 499 employees the facility was developed under horizon 2020 the eu framework programme for research and innovation and is managed by the eif it is rolled out through financial intermediaries banks and other financial institutions in eu member states and associated countries under this facility financial intermediaries are guaranteed by the eu and the eif against a proportion of their losses incurred on the debt financing covered under the facility,30/06/2016,june,2016,,,,investment plan,,80000000.00; 7600000000.00; 106800000000.00; 7500000.00
C:\Users\z004xh1j\OneDrive - Innomotics\Desktop\Comapass_Lexecon_Case_Study\data\raw_data\EC press releases part 5\ip_88_320.html,ip_88_320,subcontracting in europe,on 26 and 27 may 1988 the commission of the european communities organized a conference on this conference the first event of its type to be held on a european scale brought together more than 250 representatives of principals subcontractors and intermediary bodies chambers of commerce trade associations local development agencies etc 21 countries took part naturally including the 12 community countries in his opening speech commissioner matutes stressed the growing priority assigned by the commission to business especially small and medium sized enterprises adding that subcontracting is nothing other than an intelligent response by firms seeking to maintain and improve their efficiency and competitiveness five principals bmw bang olufsen aerospatiale gruppo finanziario tessile and siemens then told the conference how their subcontracting networks were structured followed by four subcontractors who in turn explained how they worked for their clients these contributions made it clear that this was a time for specialization and partnership a growing proportion of industrial production is subcontracted no longer to make up for isolated shortages of production capacity but because technological change and international competition have reached such a pitch that every element every function in a whole has to be entrusted to the most able this has its counterpart in a more balanced and equal relationship in which the subcontractor is regarded more so than in the past as an equal this represents an enormous challenge for subcontracting firms to be sure they are no longer the poor relation in industrial circles with the unwanted jobs left to them but in obtaining their emancipation so to speak they must as an inevitable consequence take responsibility and modernize responsibility for quality modernization in order to reduce slowness and delays and guarantee the greatest possible flexibility in production and deliveries european subcontractors have to adopt the methods of management and organization used in japan where the five zeros rule holds sway zero delays zero stocks zero breakdowns zero paper zero faults it was indeed the japanese experience with which the first day concluded with a contribution from an eminent representative of honda motors the four round table workshops on the second day were devoted to more detailed discussion of these various aspects and to clarifying the role which intermediary bodies can and must play in this development in his closing speech mr mayhew the director of the small business task force drew the attention of those present to the activities in particular of the business cooperation centre in promoting transnational subcontracting the recent launch of bc net was an important element in this he reaffirmed the commission s desire to bring in measures to improve the supply of information on transnational subcontracting and specific market opportunities promote co contracting and obtain mutual recognition of certification procedures,31/05/1988,may,1988,,,,,,
C:\Users\z004xh1j\OneDrive - Innomotics\Desktop\Comapass_Lexecon_Case_Study\data\raw_data\EC press releases part 5\ip_93_458.html,ip_93_458,commission approves the ebu eurovision system,on 11 june the commission adopted a decision which grants an exemption art 85 3 of the treaty under european competition law to the eurovision system operated by the european broadcasting union in the field of sport progammes common purchases and exchanges of sports programmes the european broadcasting union ebu is the association of public mission oriented european broadcasters 67 members in 47 european countries its members are mostly public service broadcasters although there are some private ones also which nevertheless under national law and practice are subject to a number of obligations reflecting the public mission conferred on them purely commercial broadcasters are not admitted as members the eurovision system operated by the ebu and its members consists in an exchange of programmes in particular sports programmes and the joint purchasing of the relevant television rights the joint purchasing of rights to international sports events is restrictive of competition since in joint negotiations the ebu members benefit from a combined buying power which reduces the competition between themselves and gives them a certain competitive advantage vis à vis third party channels however the system provides for a number of improvements reduction of transaction costs rationalization and cost savings which benefit in particular small member channels from smaller countries allowing them to show more sports programmes and of better quality than would otherwise be the case in addition the cooperation of member channels within the eurovision system facilitates cross border broadcasting and contributes to the development of a single european broadcasting market moreover the ebu agreed to grant non member channels contractual access to the sports programmes in question under a new scheme of rules submitted to the commission on 26 february 1993 the new scheme allows non member channels access on reasonable terms and conditions timing financial arrangements for deferred transmissions extracts and news but also live transmissions with regard to all events which the ebu members do not themselves broadcast live more restrictive clauses of a previous scheme which had given rise to wide spread criticism in the industry have been removed at the request of the commission details of the new scheme can be obtained from the ebu or its national member channels in view of the new scheme the commission decided to grant an exemption until 25 february 1998 for sport events which will safeguard the fulfilment of the ebu members public mission until while at the same time allowing third party channels to get appropriate access to the sports programmes in question on a contractual basis,11/06/1993,june,1993,,,,,,
C:\Users\z004xh1j\OneDrive - Innomotics\Desktop\Comapass_Lexecon_Case_Study\data\raw_data\EC press releases part 5\ip_95_386.html,ip_95_386,commission extends term of synthetic fibres code,code on aid to the synthetic fibres industry period of validity of the code extended by nine months to 31 3 96 consultancy study on the efficacy of the code since its introduction in 1977 the award of aid to the synthetic fibres industry has been subject to strict control since 1977 when in recognition of the low average capacity utilisation rate for community producers and the consequent loss of jobs as well as the risk that continuing aid to the industry would lead to further deterioration of the situation and distort competition the commission proposed appropriate measures under article 93 1 of the ec treaty the measures have come to be known as the code on aid to the synthetic fibres industry and the scope of the code has been progressively refined in terms of the products and industrial processes covered and the criteria for the authorization of aid coming within the scope of the code have been progressively tightened the current version of the code1 which came into effect on 1 1 1993 requires member states to notify the commission of any plan to grant aid in whatever form to synthetic fibres producers by way of support for such activities it applies to the production2 of all types of staple fibre and filament yarn based on polyester polyamide acrylic or polypropylene irrespective of whether the end use is industrial or textile proposals to award aid will only be authorised if they would result in a significant reduction in production capacity on 19 7 94 the commission extended the period of validity of the current code to 30 6 1995 in december 1994 because the code was introduced almost twenty years ago commissioner van miert decided that there should be an independent and objective consultancy study of the operation of the system of control embodied in the current code in january 1995 tenders were issued and a contractor was selected in march the study has two objectives firstly to assess the efficacy of the code in terms of its practical effects since 1977 thereby inter alia testing the claim that the code has been effective in curbing the tendency to overcapacity in the sector and secondly to determine whether or not in light of the changes in the structure of the industry and in the markets for the fibres currently covered by the code there is a continuing need for appropriate measures on aid to this industry the study will involve consultation with inter alios producers of synthetic fibres and industries for which fibres constitute a raw material representative bodies the commission and member states as the study might conclude that there should continue to be some form of appropriate measures on aid to the industry a parallel but separate invitation to tender was issued for a second study on the future control of aid to this industry with the caveat that the commission would decide in light of the conclusions of the first study whether or not this second study was required this study would consider anew the form and nature of control of aid to this sector and would not simply consider how to modify the current code it would make specific recommendations on inter alia the rationale and aim of control the methodology in terms of the criteria against which proposals should be assessed and the conditions for authorization it would also ensure that the new measures took account of the potentially conflicting objectives set out in article 3 of the ec treaty ensuring that competition in the internal market is not distorted strengthening economic and social cohesion and industrial competitiveness as well as other objectives such as the encouragement of small firms one of the principal objectives of the first study described above will be to determine whether or not there is sufficient reason to continue to apply specific provisions to control aid to this industry irrespective of whether or not any alternative horizontal system is in place therefore and given the continuing relatively low average rate of utilization of capacity for the production of the fibres within the eea and in the absence of any alternative means of control the commission considered that there were not at this time clear grounds for simply discontinuing the application of specific provisions to control state aid to this industry by allowing the code to lapse in addition the second study which will only take place if the first study were to conclude that control should continue and if that conclusion was accepted would make a thorough re assessment of all aspects of the issue in order to determine the most appropriate means of future control therefore the commission considered that it would at this time be premature and unnecessarily disruptive to those affected by the code to revise it substantively in view of the time needed to complete the first study and if it takes place the second study and in the light of the outcome to decide whether to abolish revise or retain the code and consult member states the commission extended the period of validity of the code by nine months this extension is subject to the condition that the commission may abolish or revise the code at any time before 31 3 1996 and in parallel with the study of the code work will continue on drawing up a horizontal system of control for state aid in support of major investments although it would be without prejudice to the question of whether any such system if introduced as planned should run in parallel with the code or replace it 1 oj c 346 30 12 1992 and oj c 224 12 8 1994 2 defined in the code as comprising the production and texturization of such fibres and yarns and to polymerisation insofar as this operation is integrated with fibre production in terms of the machinery used,12/04/1995,april,1995,,,,,,
