file_path,article_id,title,summary,date,month,year,published_at,country,company,case_type,related_to,monetary_amounts
C:\Users\z004xh1j\OneDrive - Innomotics\Desktop\Comapass_Lexecon_Case_Study\data\raw_data\EC press releases part 3\ip_12_1444.html,ip_12_1444,state aid crisis related aid aside scoreboard shows continued trend towards less and better targeted aid,european commission press release the european commission s 2012 state aid scoreboard revealed that the volume of national support to the financial sector actually taken by banks between october 2008 and 31 december 2011 amounted to around 1 6 trillion 13 of eu gdp the bulk 67 came in the form of state guarantees on banks wholesale funding support to the real economy on the basis of temporary crisis rules dropped to 4 8 billion in 2011 a fall of more than 50 compared with 2010 reflecting both a low uptake by companies and the budgetary constraints of most eu member states total non crisis aid decreased and stood at 64 3 billion in 2011 or 0 5 of eu gdp and continued to re focus on less distortive horizontal objectives such as aid for research and innovation protection of the environment and providing risk capital to smes the scoreboard also shows member states recovering illegal aid much faster with 85 around 13 5 billion clawed back at the end of june 2012 thanks to the commission s action probably facilitated by the pressure to consolidate public finances support to banks between 2008 and 31 december 2011 1 616 billion was actually used to support financial institutions this was composed of liquidity support 1 174 billion 9 3 of eu gdp average outstanding state guarantees on banks funding and other short term liquidity support measures and measures to support bank solvency 442 billion 3 5 of eu gdp in recapitalisation measures and treatment of impaired assets three member states accounted for nearly 60 of the total aid used those are the united kingdom 19 ireland 16 and germany 16 aid granted to the real economy temporary framework to minimise the impact of the tightening in credit conditions member states also granted aid to the real economy under a temporary framework adopted by the commission at the end of 2008 the main support measure used was a one off subsidy of up to 500 000 per company which was replaced in 2011 by the normal 200 000 amount that can be granted to a company over three years without prior clearance by the commission this was followed by subsidised loan interests or guarantees reduced interests for environmentally friendly investments and risk capital aid the temporary framework expired on 31 december 2011 between december 2008 and 1 october 2011 member states made available 82 9 billion under the temporary framework the amount taken up in 2011 was 4 8 billion while it was 11 7 billion in 2010 and 21 billion in 2009 this indicates that market funding became more available over that period long term trends in non crisis aid non crisis aid decreased and was at 64 3 billion or 0 5 of eu gdp aid to industry and services amounted to 52 9 billion or 0 42 of eu gdp of which almost 90 was earmarked for horizontal objectives of common interest most notably the commission observed a greater focus on aid measures for regional development research and environmental protection all of which contribute to the europe 2020 strategic objectives of smart sustainable and inclusive growth almost 90 of total aid is granted through block exemptions or schemes see ip 06 1765 and ip 08 1110 once approved by the commission such procedures allow member states to grant aid to individual companies without prior commission scrutiny offering member states a high degree of flexibility and low administrative burden while compatibility criteria safeguard a level playing field in the internal market only 12 5 of the total aid was assessed individually the scoreboard further shows that more than 13 5 billion representing about 85 of the total amount of illegal and incompatible aid had been repaid by beneficiaries to the granting authority at the end of june 2012 this marks a further improvement as compared to previous years the scoreboard including annexes statistics and indicators for all member states is available at http ec europa eu comm competition state aid studies reports studies reports html contacts antoine colombani 32 2 297 45 13 maria madrid pina 32 2 295 45 30,21/12/2012,december,2012,brussels,,,state aid,ip_06_1765; ip_08_1110,4800000000.00; 64300000000.00; 13500000000.00; 1616000000000.00; 1174000000000.00; 442000000000.00; 82900000000.00; 11700000000.00; 21000000000.00; 52900000000.00; 500000.00; 200000.00
C:\Users\z004xh1j\OneDrive - Innomotics\Desktop\Comapass_Lexecon_Case_Study\data\raw_data\EC press releases part 3\ip_12_320.html,ip_12_320,state aid commission endorses public service compensation for uk post office ltd,european commission press release commission vice president in charge of competition policy joaquín almunia said the network subsidy will enable the uk post office network to continue performing its fundamental social and economic role by delivering essential public services to uk citizens in remote and rural areas without unduly distorting competition the commission assessed the network subsidy under its new framework on public service compensation see ip 11 1571 and memo 11 929 the commission found that the aid does not exceed the net cost of the public service mission entrusted to the post office ltd and that its entrustment complies with public procurement rules moreover the entrustment letter and funding agreement governing the payment of the compensation contain appropriate provisions to incentivise an efficient provision of the public service in line with the post office ltd s strategic plan for the period 2012 2015 which aims at modernising and improving the provision of services over its network according to yearly efficiency milestones the commission therefore concluded that the measure is compatible with article 106 2 of the tfeu which governs the assessment of services of general economic interest under the state aid rules the commission also considered that the revised terms of the working capital facility and in particular the increased interest rate paid by the post office ltd to benefit from this liquidity facility will ensure that it is provided on market conditions the commission therefore concluded that the measure does not involve state aid those measures were notified in january 2012 in previous decisions the commission had authorized comparable financing measures for the post office ltd see ip 07 288 and ip 11 346 background the post office ltd operates a nationwide network of around 11 500 post office counter outlets that provide over the counter access to social benefit payments basic banking and other services in the uk part of these offices especially rural ones would not be commercially viable but are maintained as a public service because they fulfill important functions for the communities they serve the network subsidy is intended to cover the extra cost deriving from the post office s public service obligation between 01 april 2012 and 31 march 2015 the non confidential version of the decision will be made available under the case number sa 33054 in the state aid register on the dg competition website once any confidentiality issues have been resolved new publications of state aid decisions on the internet and in the official journal are listed in the state aid weekly e news contacts antoine colombani 32 2 297 45 13 maria madrid pina 32 2 295 45 30,28/03/2012,march,2012,brussels,,uk post office ltd,state aid,ip_11_1571; ip_07_288; ip_11_346,
C:\Users\z004xh1j\OneDrive - Innomotics\Desktop\Comapass_Lexecon_Case_Study\data\raw_data\EC press releases part 3\ip_12_849.html,ip_12_849,state aid commission approves spanish recapitalisation scheme for credit institutions,european commission press release the european commission has approved until 31 december 2012 a new spanish scheme aimed at strengthening the capital basis of credit institutions under eu state aid rules the scheme will provide state support to banks which need to cover short term capital needs following the stress test currently being conducted under the memorandum of understanding on financial sector policy conditionality mou in addition the scheme serves as a backstop facility for banks with urgent capital needs materialising before the stress test is completed the commission found the scheme to be in line with its rules on state support to banks during the crisis see ip 08 1495 ip 08 1901 ip 10 1636 and ip 11 1488 because it is limited in time and scope and contains exit incentives joaquín almunia vice president of the commission in charge of competition policy said the recapitalisation scheme is the first stepping stone for fulfilling the recently concluded memorandum of understanding under the programme the spanish financial sector will be rebuilt on a healthier basis this is a key precondition for sustainable growth in spain the scheme sets the conditions under which the fondo de reestructuración ordenada bancaria frob will strengthen the own resources of credit institutions which after the stress tests would show a capital shortfall that they intend to cover with private sector resources in the mid term but need support from the state during an interim period in addition the scheme serves as a backstop facility for banks with urgent capital needs which materialise before the stress test is completed and which could result in those banks losing their banking license or posing a threat to financial stability the commission found the scheme to be in line with eu state aid rules established for aid to banks in the current financial crisis see ip 08 1495 ip 08 1901 ip 10 1636 and ip 11 1488 this is because the measures are limited in time and scope and contain incentives to redeem the state participation the distortive effect of the recapitalisations will be minimised by adequate remuneration conditions including annual step up clauses conditions for a recapitalisation also include bans on the payment of dividends and on coupons for hybrid capital instruments banks benefiting from a capital injection need to provide a restructuring plan showing how they will restore their long term viability without continued state support background this recapitalisation scheme is an essential element for the completion of the restructuring of the spanish banking sector and the first of a series of milestones planned in the memorandum of understanding in order to increase the long term resilience of the banking sector in spain the non confidential version of the decision will be made available under the case number sa 35069 in the state aid register on the dg competition website once any confidentiality issues have been resolved new publications of state aid decisions on the internet and in the official journal are listed in the state aid weekly e news contacts antoine colombani 32 2 297 45 13 marisa gonzalez iglesias 32 2 295 19 25,25/07/2012,july,2012,brussels,,,state aid,ip_08_1495; ip_08_1901; ip_10_1636; ip_11_1488,
C:\Users\z004xh1j\OneDrive - Innomotics\Desktop\Comapass_Lexecon_Case_Study\data\raw_data\EC press releases part 3\ip_13_167.html,ip_13_167,mergers commission prohibits ryanair s proposed takeover of aer lingus,european commission press release the european commission has prohibited on the basis of the eu merger regulation the proposed takeover of the irish flag carrier aer lingus by the low cost airline ryanair the acquisition would have combined the two leading airlines operating from ireland the commission concluded that the merger would have harmed consumers by creating a monopoly or a dominant position on 46 routes where currently aer lingus and ryanair compete vigorously against each other this would have reduced choice and most likely would have led to price increases for consumers travelling on these routes during the investigation ryanair offered remedies the commission assessed them thoroughly and carried out several market tests however the remedies proposed fell short of addressing the competition concerns raised by the commission commission vice president in charge of competition policy joaquín almunia said the commission s decision protects more than 11 million irish and european passengers who travel each year to and from dublin cork knock and shannon for them the acquisition of aer lingus by ryanair would have most likely led to higher fares during the procedure ryanair had many opportunities to offer remedies and to improve them however those proposals were simply inadequate to solve the very serious competition problems which this acquisition would have created on no less than 46 routes ryanair and aer lingus are by far the most important carriers operating out of ireland they compete directly on 46 routes it was the third time that the proposed acquisition of aer lingus by ryanair was notified to the commission in 2007 the commission prohibited ryanair s first attempt to acquire aer lingus see ip 07 893 and this decision was upheld by the eu general court memo 10 300 in 2009 the second notification by ryanair was withdrawn the commission took into account the changes in market circumstances since 2007 for example the fact that the market positions of ryanair and aer lingus have become even stronger with their combined market shares going up from 80 in 2007 to 87 in 2012 for short haul flights out of dublin the number of routes to and from ireland operated in competition by ryanair and aer lingus has increased from 35 in 2007 to 46 in 2012 the combination of ryanair and aer lingus would have led to very high market shares on all of these 46 routes on 28 routes the proposed merger would have created an outright monopoly on 11 further routes the only alleged competitive constraint to the merged entity would have come from charter airlines however this constraint would have remained weak because charter airlines have a very different business model finally on 7 routes ryanair and aer lingus operate alongside other scheduled carriers in addition to their very high market shares ryanair and aer lingus are very close competitors if not each other s closest competitors on these routes the reason is that the business model of competing scheduled operators tends to focus on bringing connecting passengers to their own network hubs typical examples are british airways to london heathrow lufthansa to frankfurt and air france to paris charles de gaulle as opposed to the point to point connections that ryanair and aer lingus offer the proposed merger would therefore have removed the currently vibrant competition between ryanair and aer lingus on all these routes where their activities overlap moreover the commission s investigation confirmed the existence of high barriers to entry stemming in particular from ryanair s and aer lingus strong market positions in ireland the market investigation showed that there was no prospect that any new carrier would enter the irish market after the merger in particular by the creation of a base at the relevant irish airports and challenge the new entity on a sufficient scale in short customers travelling options would have been substantially reduced and it is unlikely that competitors would have been able to sufficiently constrain the merged entity in its market behaviour higher prices for passengers would have been the likely outcome remedies proposed by ryanair ryanair offered several sets of remedies during the procedure the final remedy package consisted mainly of the divestiture of aer lingus operations on 43 overlap routes to flybe and the cession of take off and landing slots to iag british airways at london airports so that iag british airways would operate on 3 routes dublin london shannon london and cork london flybe and iag committed to operate the routes for 3 years additional slot divestitures on london ireland routes were also offered however the commission s investigation demonstrated that these remedies were insufficient to ensure that customers would not be harmed taking into account the scope and magnitude of the competition concerns raised by the proposed transaction on the 46 routes in particular the commission found that flybe was not a suitable purchaser capable of competing sufficiently with the ryanair aer lingus merged entity the investigation also showed that iag british airways would not constrain the merged entity to a sufficient degree and would have little incentive to stay on the routes beyond a 3 year period in addition the commission could not conclude with the requisite degree of certainty that the proposed commitments could actually be put in place in a timely manner nor was it certain that they would work in practice and for a sustained period of time during the investigation the commission gathered views from a large number of market participants in ireland and internationally including competitors customers travel agents consumer associations public authorities and airport operators the commission carried out such market tests on ryanair s successive remedy proposals three times background the deal was notified to the commission for regulatory clearance under the european union s merger regulation on 24 july 2012 on 29 august 2012 the commission started an in depth investigation see ip 12 921 the deadline for a decision was extended to assess the remedies submitted on 7 december 2012 the parties were warned in the statement of objections sent in november 2012 that the merger raised serious concerns and could be prohibited since 2004 the commission has examined 15 mergers and several alliances in the air transport sector this decision is the third prohibition the first prohibition related to the initial attempt by ryanair to acquire aer lingus in 2007 the second prohibition decision was about the proposed acquisition by olympic air of aegean airlines in 2011 see ip 11 68 all the prohibition decisions were related to transactions involving two airlines having large bases at the same home airport when assessing airline mergers the commission first analyses the effects of the proposed transaction on the routes on which both companies operate in addition the commission takes into account whether the merger would affect the possibility of one airline to discipline the other one by entering a certain route at any given moment both questions require particular attention when the merging airlines have large bases at the same home airport companies and products ryanair is a low fares carrier operating point to point scheduled air services essentially in europe the company has a fleet of 305 aircraft and 51 bases across europe with the most important bases being london stansted brussels charleroi milan bergamo and dublin in the iata summer season 2012 ryanair operated in particular 62 short haul routes ex dublin aer lingus is an irish based carrier it offers essentially point to point scheduled air transport services aer lingus is based principally at dublin airport wherefrom it operates a substantial portion of its scheduled flights in the summer season 2012 air lingus including aer arann operated 66 short haul routes ex dublin aer lingus is not a member of any airline alliance and develops a concept of open network architecture whereby its neutrality allows it to partner across alliances and offer connectivity through major hubs to worldwide destinations in addition to carrying point to point traffic ryanair s minority shareholding in aer lingus represents 29 8 of aer lingus total issued share capital and makes ryanair the largest shareholder in aer lingus this shareholding is currently under review by the uk competition commission the irish government is the next largest shareholder with a stake of around 25 1 merger control rules and procedures the commission has the duty to assess mergers and acquisitions involving companies with a turnover above certain thresholds see article 1 of the merger regulation and to prevent concentrations that would significantly impede effective competition in the eea or any substantial part of it the vast majority of notified mergers do not pose competition problems and are cleared after a routine review from the moment a transaction is notified the commission generally has a total of 25 working days to decide whether to grant approval phase i or to start an in depth investigation phase ii there are currently two other on going phase ii investigations the first one examines the proposed combination of munksjö and the european label and processing business of ahlstrom in the paper industry see ip 12 1338 with a deadline on 16 may 2013 the second phase ii investigation concerns syniverse s project to acquire rival mach in the data house clearing sector see ip 12 1439 with a deadline on 30 may 2013 more information on the case is available at http ec europa eu competition elojade isef case details cfm proc code 2 m 6663 see also memo 13 144 contacts antoine colombani 32 2 297 45 13 marisa gonzalez iglesias 32 2 295 19 25 maria madrid pina 32 2 295 45 30,27/02/2013,february,2013,brussels,,aer lingus,merger,ip_07_893; ip_12_921; ip_11_68; ip_12_1338; ip_12_1439,
C:\Users\z004xh1j\OneDrive - Innomotics\Desktop\Comapass_Lexecon_Case_Study\data\raw_data\EC press releases part 3\ip_13_193.html,ip_13_193,state aid commission approves finnish short term export credit insurance scheme,european commission press release the european commission has found a finnish short term export credit insurance scheme to be in line with eu state aid rules the scheme is limited to insurance cover that is currently not available on the private market and it ensures that adequate rates are charged under the scheme the commission authorised the measure until 31 december 2015 commission vice president in charge of competition policy joaquín almunia said the export credit insurance scheme targets areas where the market is currently not offering insurance cover such as risks for smes while at the same time providing safeguards to limit distortions of competition under the notified scheme the finnish state agency finnvera plc would provide short term export credit insurance coverage to companies established in finland cover would be available only for financially sound transactions two categories of risks are covered risk cover for smes and single risk cover with a risk period at least 181 days and less than two years where the risk is associated to a single export transaction not covered under portfolio insurance from private insurers the safeguards ensure that the state will cover only transactions for which private cover is not available in the market and that private insurers are not crowded out should they be willing to provide cover for such risks in this context the premiums for the cover are adequate and in line with the 2012 export credit communication as the minimum premium charged by finnvera fulfils the conditions set out in the communication finland will also make information on the use of the scheme publicly available the commission therefore concluded that the measure complies with the conditions laid down in its communication on short term export credit insurance see rules here background the non confidential version of the decision will be made available under case number sa 35701 in the state aid register on the competition dg website once any confidentiality issues have been resolved new publications of state aid decisions on the internet and in the official journal are listed in the state aid weekly e news contacts antoine colombani 32 2 297 45 13 maria madrid pina 32 2 295 45 30,06/03/2013,march,2013,brussels,,,state aid,,
