file_path,article_id,title,summary,date,month,year,published_at,country,company,case_type,related_to,monetary_amounts
C:\Users\z004xh1j\OneDrive - Innomotics\Desktop\Comapass_Lexecon_Case_Study\data\raw_data\EC press releases part 2\ip_08_939.html,ip_08_939,mergers commission approves planned acquisition of endesa by enel and acciona,the european commission has approved under the eu merger regulation the acquisition of sole control through a public takeover bid for endesa s a a spanish energy company mainly active in the electricity sector by enel s p a based in italy and acciona s a based in spain after examining the operation the commission concluded that the proposed transaction would not significantly impede effective competition in the european economic area eea or any substantial part of it enel is an italian electricity operator active in the generation distribution and supply of electricity mainly in italy where it is the main provider of electricity to both domestic and industrial users and also in spain bulgaria romania slovakia russia france and north and south america it is also active in the purchase and sale of natural gas for domestic electricity generation and gas operations in italy acciona is a corporate group primarily based in spain whose main lines of business are the development and management of infrastructure and real estate projects the provision of transport urban and environmental services as well as the development and operation of renewable energies endesa is a spanish electricity operator that is to a limited extent also active in other european countries in particular in portugal france italy germany and poland in addition endesa is active in south america and north africa in spain endesa is also present in the gas sector endesa s shares are listed on the madrid and the new york stock exchanges on 26 th march 2007 enel and acciona agreed to acquire joint control of endesa by launching a joint public bid for the shares in endesa that they did not already own or control on 2 nd april 2007 enel acciona and e on agreed that enel and endesa would transfer a number of rights and assets to e on an energy company headquartered in germany with its main activities in the generation transmission and supply of electricity and gas throughout europe and in the us these rights and assets include enel s existing electricity generation distribution and supply business in spain except for its stake in eufer certain additional endesa assets located in spain and endesa s current business in italy together with related businesses in france poland and turkey these businesses do not fall within the scope of the notified concentration since enel and acciona would not acquire any lasting control over them the acquisition of joint control of endesa by enel and acciona had already been notified to and authorised by the commission on 5 july 2007 see ip 07 1023 however on 18 march 2008 enel e on and acciona concluded another agreement modifying their 2007 agreement concerning the assets to be transferred to e on this new agreement excludes one of endesa s power plants that was to be divested to e on the foix power plant in france and substitutes one power plant in spain besos 3 for another one tarragona 1 under the merger regulation the change in scope of the transaction required a new notification as the previous decision had been taken on the basis of a different scope however the commission s analysis showed that the impact of the amendments on the affected market is negligible because of the minimal changes in the market shares of the parties after the new agreement competition in the spanish market for the wholesale supply of electricity which is the only horizontally affected market did not materially change in the last year and a number of other companies such as iberdrola unión fenosa and edp hidrocantábrico are competing with the parties in this market the commission therefore concluded that the proposed transaction would not raise competition concerns more information on the case will be available at http ec europa eu comm competition mergers cases index m103 html m 5171,16/06/2008,june,2008,brussels,,,merger,ip_07_1023,
C:\Users\z004xh1j\OneDrive - Innomotics\Desktop\Comapass_Lexecon_Case_Study\data\raw_data\EC press releases part 2\ip_09_260.html,ip_09_260,state aid commission approves german real economy crisis measure,the european commission has approved under ec treaty state aid rules a german aid measure that addresses mid sized enterprises increased demand for funding for research and development r d in the current financial and economic crisis the aid measure temporarily amends the existing aid scheme zentrales innovationsprogramm mittelstand zim initially targeted at funding r d activities of smes only now r d projects of mid sized enterprises of up to 1 000 employees will also be eligible for funding until 31 12 2010 germany will commit an extra budget of 900 million for that purpose the commission concluded that the proposed aid is in line with the eu rules on state aid for research development and innovation see ip 06 1600 and memo 06 441 because it will not exceed the prescribed limits and will provide an incentive to increase the level of r d i activity competition commissioner neelie kroes said r d projects usually entail considerable risks in the current crisis smaller players have less access to financing as the financial market is extremely risk averse however the european industry needs a sustained high level of r d to become more competitive in the global economy zim encourages businesses to continue investing in the future in addition it demonstrates that member states can use existing eu state aid rules member states to counter the crisis the extension of zim to enterprises of up to 1 000 employees and an increase of zim s budget by 900 million to 2 4 billion in total is one of the actions provided for by the german government s second economic stimulus package konjunkturpaket ii the objective of that broad policy package is to mitigate the impact of the financial and economic crisis in germany in particular the aid is aimed at market effective r d projects with duration between one and two years the german government thus intends to stimulate mid sized enterprises to maintain their level of r d and remain competitive on the global market germany expects to switch back zim to its previous funding rules after 31 12 2010 however in case further modifications are needed after that date the german government will formally notify such plans to the commission the non confidential version of the decision will be made available under the case number n65 2009 in the state aid register on the dg competition website once any confidentiality issues have been resolved new publications of state aid decisions on the internet and in the official journal are listed in the state aid weekly e news,13/02/2009,february,2009,brussels,,,state aid,ip_06_1600,900000000.00; 2400000000.00
C:\Users\z004xh1j\OneDrive - Innomotics\Desktop\Comapass_Lexecon_Case_Study\data\raw_data\EC press releases part 2\ip_09_50.html,ip_09_50,state aid commission approves recapitalisation of anglo irish bank,the european commission has approved under ec treaty state aid rules an emergency recapitalisation worth 1 5 billion that the irish authorities intend to grant to anglo irish bank the commission found the measure to be in line with its guidance communications on state aid during the current financial crisis see ip 08 1495 and ip 08 1901 the measure constitutes an adequate means to remedy a serious disturbance in the irish economy while avoiding undue distortions of competition and is therefore compatible with article 87 3 b of the ec treaty in particular the measure is limited in scope requires an adequate remuneration and provides safeguards to minimise distortions of competition on 19 th december 2008 the irish authorities informed the commission of their intention to recapitalise anglo irish bank with 1 5 billion on 8 th january 2009 the irish authorities formally notified this measure due to the current financial crisis even banks that meet the regulatory solvency ratios may experience distress and be required to reinforce their capital in addition to difficulties caused by the global financial crisis recent developments with regard to the anglo irish bank s corporate governance increased the need to reassure the financial markets of the bank s stability against this background the irish authorities decided to inject 1 5 billion into anglo irish bank the shares to be issued will qualify as core tier 1 capital and will produce a dividend of 10 payable annually at the discretion of the bank and in priority to dividends on ordinary shares dividends on the shares are payable in cash or if the bank is not able to pay in cash in ordinary shares on the basis of the average daily closing price over the previous 30 trading days the shares will carry 75 of the voting rights in anglo irish bank the bank can repurchase the shares at par during maximum five years after that period shares can be repurchased at 125 of par no dividends on ordinary shares are allowed when no dividend on the shares to be issued is paid to the state the commission concluded that the measure complies with the conditions laid down in its guidance communications see ip 08 1495 and ip 08 1901 in particular the measure meets the following criteria necessity anglo irish bank has an important role within the irish financial sector a loss of confidence in this institution could have led to a further disturbance of the current financial situation and harmful spill over effects to the economy as whole appropriate own contribution a discretionary remuneration of 10 per annum is consistent with the commission s recapitalisation communication the commission also took into account that the probability of return for the state is reinforced through the possibility of combining the dividend payment in cash and ordinary shares avoidance of undue distortions of competition the package foresees sufficient behavioural rules to prevent an abuse of the state support e g prohibition of advertising of the aid restrictions on the payment of dividends restrictions on executives remuneration nomination of public interest representatives to the bank s board as well as the submission of a restructuring plan within 6 months for commission s assessment and approval the non confidential version of the decision will be made available under the case number n9 2009 in the state aid register on the dg competition website once any confidentiality issues have been resolved new publications of state aid decisions on the internet and in the official journal are listed in the state aid weekly e news,14/01/2009,january,2009,brussels,,anglo irish bank,state aid,ip_08_1495; ip_08_1901,1500000000.00
C:\Users\z004xh1j\OneDrive - Innomotics\Desktop\Comapass_Lexecon_Case_Study\data\raw_data\EC press releases part 2\ip_11_298.html,ip_11_298,air transport commission launches infringement procedures against six member states over agreements with russia on equal treatment of eu airlines and siberian overflights,the european commission has today launched infringement procedures against estonia greece hungary lithuania malta and slovenia over their bilateral air service agreements with russia sending each of these member states a formal request for information known as a letter of formal notice the commission is concerned that the agreements may hinder equal treatment of eu airlines and competition between european airlines and provide the basis for siberian overflight charges that may be illegal under eu anti trust rules similar letters of formal notice have already been sent to 17 other member states in recent months and the commission is now assessing the compliance with eu law of the remaining four member states bilateral aviation agreements with russia the fact that european union airlines have to pay to fly over siberia on their way to asian destinations can not only make the flights more expensive but can also lead to unfair competition between eu and non eu airlines the view of the european commission is that air transport agreements must treat all eu airlines equally and respect antitrust rules otherwise some eu airlines may be treated less favourably than their direct competitors or face paying unreasonable additional charges which can get passed on to consumers in higher air fares freedom of establishment bi lateral air service agreements between an individual member state and a non eu country have to include an eu designation clause recognising that the terms apply equally to all eu airlines and not just the airlines of that member state this is an essential part of the single european aviation market which was created in the early 1990s guaranteeing that airlines are entitled to operate under the same conditions anywhere in the eu the requirement to have an eu designation clause was confirmed in the open skies rulings of the court of justice in 2002 see ip 02 1609 the court stated that provisions limiting the benefits of air service agreements to nationals of the member state concerned are in breach of eu rules on freedom of establishment now laid down in article 49 of the treaty on the functioning of the eu most agreements with non eu countries have since been adapted to the court ruling russia is one of the few countries in the world that fails to recognise that all eu carriers must be treated equall y and that the terms of any bilateral agreement must include an eu designation clause and apply to all this creates serious practical problems putting at risk traffic rights for example for airlines taken over by a carrier from another eu member state siberian overflight charges designated eu airlines are obliged to pay siberian overflight charges for routes to many asian destinations it is estimated that in 2008 alone the eu carriers concerned paid around usd 420 million in charges most of it directly to the russian airline aeroflot the commission is concerned that this is in breach of eu antitrust law whereby airlines should not be forced into concluding a commercial agreement with a direct competitor the commission is also concerned that this is in breach of international law chicago convention these bilateral agreements also impose different conditions on eu airlines depending on the country they are based in which creates an additional distortion of competition in the end passengers risk having to pay more for their flights than they would otherwise need to next steps member states have two months to respond to the letters of formal notice if they fail to react satisfactorily the commission will send a reasoned opinion requesting the member states in question to amend their bilateral air service agreements with russia letters of formal notice were already sent in october 2010 to austria finland france and germany see ip 10 1425 in january 2011 to belgium denmark italy luxembourg the netherlands sweden and the uk see ip 11 74 and in february 2011 to cyprus ireland poland portugal slovakia and spain the commission is actively assessing the c ompliance with eu law of the bilateral air service agreements that the remaining four member states have with russia see also memo 11 167 for more information on eu infringement procedures see memo 11 162,14/03/2011,march,2011,,russia,air transport: commission; eu airlines,air transport,ip_02_1609; ip_10_1425; ip_11_74,420000000.00
C:\Users\z004xh1j\OneDrive - Innomotics\Desktop\Comapass_Lexecon_Case_Study\data\raw_data\EC press releases part 3\ip_11_1483.html,ip_11_1483,mergers commission approves acquisition of rbs assets by banco santander,european commission press release the commission s examination focussed on the impact of the proposed acquisition of the assets collectively known as rainbow on the markets for personal current accounts mortgages card based consumer credit and cash handling services the analysis confirmed that santander presently has a relatively limited share of the uk commercial banking market and the overlaps in these areas resulting from the acquisition are low the commission therefore concluded that the transaction would not significantly impede effective competition in the european economic area eea 1 or any substantial part of it the rainbow assets were offered for divestment by rbs together with some other businesses in the context of the commission s investigation of state support granted to rbs including two state recapitalisations totalling more than 45 billion and the treatment of a huge portfolio of impaired assets see ip 09 1915 rbs offered the divestments to gain the commission s approval of its restructuring plan as a measure to share the costs of its restructuring and to compensate for the distortions of competition created by the massive state support it received today s decision is without prejudice to rbs obligations under the state aid procedure the transaction was notified to the commission on 21 october 2011 for regulatory clearance under the eu merger control rules the transaction was re notified given an amendment to the initial agreement leading to a change in the precise composition of the transferred business background rainbow consists of the royal bank of scotland group plc s rbs branch related retail and small and medium sized enterprise sme business in england and wales the natwest branch related retail and sme business in scotland along with certain mid corporate customer accounts in the uk in total approximately 300 branches and around 40 sme and business banking centres the perimeter of the transaction was changed with an amendment to the initial agreement so that now credit and charge cards held by transferring rainbow customers in the transaction are included as well as some other minor changes merger control rules and procedures the commission has the duty to assess mergers and acquisitions involving companies with a turnover above certain thresholds see article 1 of the merger regulation and to prevent concentrations that would significantly impede effective competition in the eea or any substantial part of it the vast majority of mergers do not pose competition problems and are cleared after a routine review from the moment a transaction is notified the commission generally has a total of 25 working days to decide whether to grant approval phase i or to start an in depth investigation phase ii more information on the case will be available at http ec europa eu competition elojade isef case details cfm proc code 2 m 6405 contacts amelia torres 32 2 295 46 29 marisa gonzalez iglesias 32 2 295 19 25 1 the eu plus iceland liechtenstein and norway,30/11/2011,november,2011,brussels,,banco,merger,ip_09_1915,45000000000.00
C:\Users\z004xh1j\OneDrive - Innomotics\Desktop\Comapass_Lexecon_Case_Study\data\raw_data\EC press releases part 3\ip_11_1515.html,ip_11_1515,state aid commission approves lithuanian short term export credit insurance scheme,european commission press release commission vice president in charge of competition policy joaquín almunia said the lithuanian scheme supports export firms with the insurance cover they cannot obtain on the private market and allows them to create value while avoiding the crowding out of private insurers under the notified scheme the lithuanian state owned company invega will provide additional short term export credit insurance coverage to companies established in lithuania which are confronted with a temporary insufficiency of cover in the private market for credits in respect of exports to france italy poland spain estonia and the united kingdom only financially sound transactions will be eligible for support invega s share will not exceed 50 of the total cover and exporters will have to retain the responsibility for at least 20 of the underlying risk the commission concluded that the measure complies with the conditions laid down in its communication on short term export credit insurance see rules at http ec europa eu competition state aid legislation instruments html in contrast with the portuguese short term export credit insurance scheme see ip 11 1392 for which the european commission has concluded recently that it was in breach of eu rules lithuania has supplied sufficient proof that the necessary cover is temporarily unavailable on the private insurance market owing to a lack of insurance capacity in addition the premiums required by invega are aligned with those of the private credit insurance market in particular the premiums are set at a level that provides an incentive for exporters to have recourse to private insurers once there is again sufficient cover on the private market moreover the measure provides safeguards ensuring that financially unsound transactions and counterparties that would not obtain cover even under normal market conditions do not unduly benefit from the measure the commission has therefore concluded that this measure represents an appropriate means of supporting export activities in lithuania without adversely affecting trading conditions and as such is compatible with article 107 3 c of the treaty on the functioning of the european union tfeu background the non confidential version of the decision will be made available under the case number sa 33854 in the state aid register on the dg competition website once any confidentiality issues have been resolved new publications of state aid decisions on the internet and in the official journal are listed in the state aid weekly e news contacts amelia torres 32 2 295 46 29 maria madrid pina 32 229 54530,07/12/2011,december,2011,brussels,,,state aid,ip_11_1392,
